{
  "bundle_version": "4.14.0",
  "checks": [
    {
      "details": {
        "bundle_dir": "examples/bundles/example"
      },
      "name": "bundle_directory_contract",
      "status": "passed"
    },
    {
      "details": {
        "package": "policyengine-core",
        "version": "3.26.0"
      },
      "name": "package_pin",
      "status": "passed"
    },
    {
      "country": "us",
      "details": {
        "basis": "bundle_candidate",
        "data_package": "policyengine-us-data",
        "data_package_version": "1.104.0",
        "model_package": "policyengine-us",
        "model_package_version": "1.715.2"
      },
      "name": "compatibility_assertion",
      "status": "passed"
    }
  ],
  "generated_at": "2026-06-05T00:00:00Z",
  "metadata": {
    "generated_by": "scripts/validate_bundle.py",
    "validation_kind": "registry"
  },
  "schema_version": 2,
  "status": "passed"
}
